{
  "schema_version": "erp-agent-message/v1",
  "message_id": "f5be6158-03c7-47d5-bf90-d89233359c15",
  "message_type": "VERIFICATION",
  "created_at": "2026-08-11T15:45:30+08:00",
  "task_id": "AGENT-R1-5",
  "agent": {
    "agent_id": "erp-guardian-r1-5",
    "instance_id": "erp-guardian-r1-5-native7",
    "capability_profile": "ERP_READ_ONLY",
    "context_manifest_digest": "sha256:63c2a4fd87ee090e12b78068e64760ff78586dca6c3382452a60f59b75d17cbe"
  },
  "role": "ERP_CONTRACT_GUARDIAN",
  "gate": "ERP_CONTRACT",
  "input": {
    "base_sha": "1f55696b124c899d49f4505c9ad0cd238d910b24",
    "candidate_sha": "2843b3df8eeff05584a2b492ff028ca812674164",
    "task_packet_revision": 2,
    "lease_generation": 1,
    "attempt": 1,
    "artifacts": [
      "git://2843b3df8eeff05584a2b492ff028ca812674164/docs/tasks/AGENT-R1-5.md",
      "git://2843b3df8eeff05584a2b492ff028ca812674164/docs/agent-control/task-packets/AGENT-R1-5.json",
      "git://2843b3df8eeff05584a2b492ff028ca812674164/docs/ai-engineering/ERP_DOMAIN_BOUNDARIES.md",
      "git://2843b3df8eeff05584a2b492ff028ca812674164/tools/erp_agent_control/native_mvp.py",
      "git://2843b3df8eeff05584a2b492ff028ca812674164/tools/erp_agent_control/tests/test_native_mvp.py"
    ]
  },
  "assumptions": [],
  "evidence": [
    {
      "id": "E-001",
      "kind": "COMMAND_RESULT",
      "locator": "git://1f55696b124c899d49f4505c9ad0cd238d910b24..2843b3df8eeff05584a2b492ff028ca812674164?operation=diff-name-only",
      "digest": "sha256:39d4375a94cfc8c81ce82ce83453160eb2701948819cac572aad576f5f5be814",
      "exit_code": 0,
      "observed_at": "2026-08-11T15:45:30+08:00",
      "redaction": "NONE"
    },
    {
      "id": "E-002",
      "kind": "TEST_REPORT",
      "locator": "command://opt/erp/.venv/bin/python?module=tools.erp_agent_control.tests.test_native_mvp",
      "digest": "sha256:588a76da5618d6e70afe4f482d62ded358ba5a8b99c420b0e685384059506b9d",
      "exit_code": 0,
      "observed_at": "2026-08-11T15:45:30+08:00",
      "redaction": "NONE; stdout reported 60 tests, OK"
    },
    {
      "id": "E-003",
      "kind": "FILE_SNAPSHOT",
      "locator": "git://2843b3df8eeff05584a2b492ff028ca812674164/docs/tasks/AGENT-R1-5.md",
      "digest": "sha256:529216694ce3bba396b0b0b94f81143f22a54364e129bc6e56474e2af87c7ac5",
      "exit_code": null,
      "observed_at": "2026-08-11T15:45:30+08:00",
      "redaction": "NONE"
    },
    {
      "id": "E-004",
      "kind": "FILE_SNAPSHOT",
      "locator": "git://2843b3df8eeff05584a2b492ff028ca812674164/docs/ai-engineering/ERP_DOMAIN_BOUNDARIES.md",
      "digest": "sha256:c8a89a9d68bbee633b14c1fcd5f8a30d479c5d99532a3b4c3c58b59a67183504",
      "exit_code": null,
      "observed_at": "2026-08-11T15:45:30+08:00",
      "redaction": "NONE"
    },
    {
      "id": "E-005",
      "kind": "FILE_SNAPSHOT",
      "locator": "git://2843b3df8eeff05584a2b492ff028ca812674164/tools/erp_agent_control/native_mvp.py",
      "digest": "sha256:ed9471f4299185d3966a523eab45b91f1dbc2e789f4776934b58af6cdbe9be97",
      "exit_code": null,
      "observed_at": "2026-08-11T15:45:30+08:00",
      "redaction": "NONE"
    },
    {
      "id": "E-006",
      "kind": "FILE_SNAPSHOT",
      "locator": "git://2843b3df8eeff05584a2b492ff028ca812674164/tools/erp_agent_control/tests/test_native_mvp.py",
      "digest": "sha256:dea966d05fb96d567a3164f89bf5ed48d5e7f226caaca2dbe2ff73d0a2074d86",
      "exit_code": null,
      "observed_at": "2026-08-11T15:45:30+08:00",
      "redaction": "NONE"
    }
  ],
  "changes": [],
  "tests": [
    {
      "id": "T-001",
      "command_id": "native-mvp-unittest",
      "environment": "cwd=/opt/erp; /opt/erp/.venv/bin/python; bytecode disabled; offline and without database, UAT, production, container, or deployment access",
      "result": "PASS",
      "exit_code": 0,
      "artifact": "E-002"
    }
  ],
  "risks": [
    {
      "id": "R-001",
      "severity": "LOW",
      "probability": "MEDIUM",
      "impact": "Synthetic R1.5 evidence could be incorrectly represented as runtime-enforced isolation.",
      "trigger": "The gate result is promoted beyond the documented docs/test protocol scope.",
      "mitigation": "Retain NO_RUNTIME_AUTHORITY and NOT_IMPLEMENTED/NOT_AUTHORIZED declarations for R2, UAT, production, database, and deployment capabilities.",
      "residual_risk": "Runtime enforcement remains unavailable until separately authorized and implemented."
    }
  ],
  "blockers": [],
  "recommendation": {
    "decision": "PASS",
    "reason": "All paths changed from the frozen baseline remain confined to synthetic agent-control documentation, schemas, fixtures, tooling, and tests. No ERP business tree, product Schema/Migration, package, runtime, or deployment path changed. The frozen task and ERP boundary artifacts keep PHASE4-TASK03 blocked and preserve prohibitions on UAT, production, database, deployment, D-112 product-table reuse, and R2 authority. The scoped offline suite passed all 60 tests, including strict path-scope and length-bound checks.",
    "next_action": "Accept the ERP_CONTRACT gate for candidate 2843b3df8eeff05584a2b492ff028ca812674164."
  },
  "status": "PASS",
  "minority_report": null,
  "resolves_message_ids": [],
  "resolves_claim_ids": [],
  "checkpoint": null
}
