{
  "schema_version": "erp-agent-message/v1",
  "message_id": "b7ae3204-060b-4a6b-83de-3fef6f567e12",
  "message_type": "VERIFICATION",
  "created_at": "2026-08-11T15:06:14+08:00",
  "task_id": "AGENT-R1-5",
  "agent": {
    "agent_id": "erp-guardian-r1-5",
    "instance_id": "erp-guardian-r1-5-native4",
    "capability_profile": "ERP_READ_ONLY",
    "context_manifest_digest": "sha256:806a4afb401b690930ae43923f49637b63eabb0a6fa25892654dba836fbcd646"
  },
  "role": "ERP_CONTRACT_GUARDIAN",
  "gate": "ERP_CONTRACT",
  "input": {
    "base_sha": "1f55696b124c899d49f4505c9ad0cd238d910b24",
    "candidate_sha": "3d395cc881784a78ff45841dacc1e8d48c805f0c",
    "task_packet_revision": 2,
    "lease_generation": 1,
    "attempt": 1,
    "artifacts": [
      "git://3d395cc881784a78ff45841dacc1e8d48c805f0c/docs/tasks/AGENT-R1-5.md",
      "git://3d395cc881784a78ff45841dacc1e8d48c805f0c/docs/agent-control/task-packets/AGENT-R1-5.json",
      "git://3d395cc881784a78ff45841dacc1e8d48c805f0c/docs/ai-engineering/ERP_DOMAIN_BOUNDARIES.md",
      "git://3d395cc881784a78ff45841dacc1e8d48c805f0c/tools/erp_agent_control/native_mvp.py",
      "git://3d395cc881784a78ff45841dacc1e8d48c805f0c/tools/erp_agent_control/tests/test_native_mvp.py"
    ]
  },
  "assumptions": [],
  "evidence": [
    {
      "id": "E-001",
      "kind": "COMMAND_RESULT",
      "locator": "git://1f55696b124c899d49f4505c9ad0cd238d910b24..3d395cc881784a78ff45841dacc1e8d48c805f0c?operation=diff-name-only",
      "digest": "sha256:39d4375a94cfc8c81ce82ce83453160eb2701948819cac572aad576f5f5be814",
      "exit_code": 0,
      "observed_at": "2026-08-11T15:06:14+08:00",
      "redaction": "NONE"
    },
    {
      "id": "E-002",
      "kind": "TEST_REPORT",
      "locator": "command://opt/erp/.venv/bin/python?module=tools.erp_agent_control.tests.test_native_mvp",
      "digest": "sha256:e33ae21b5c999d46f8a561b8c1aa8e8a394edb8d5ed111449e0e5a30e7159a1b",
      "exit_code": 0,
      "observed_at": "2026-08-11T15:06:14+08:00",
      "redaction": "NONE; stdout reported 56 tests, OK"
    },
    {
      "id": "E-003",
      "kind": "FILE_SNAPSHOT",
      "locator": "git://3d395cc881784a78ff45841dacc1e8d48c805f0c/tools/erp_agent_control/native_mvp.py",
      "digest": "sha256:0f30b9ff66edb240e63b276fac28d67537c1b746f7559dee6c50358edff7f693",
      "exit_code": null,
      "observed_at": "2026-08-11T15:06:14+08:00",
      "redaction": "NONE"
    },
    {
      "id": "E-004",
      "kind": "FILE_SNAPSHOT",
      "locator": "git://3d395cc881784a78ff45841dacc1e8d48c805f0c/tools/erp_agent_control/tests/test_native_mvp.py",
      "digest": "sha256:7c74033b28ed13d0a62069e02a1e3abef737d3fd8beed8c3da1ad7cfcd3ea619",
      "exit_code": null,
      "observed_at": "2026-08-11T15:06:14+08:00",
      "redaction": "NONE"
    }
  ],
  "changes": [],
  "tests": [
    {
      "id": "T-001",
      "command_id": "native-mvp-unittest",
      "environment": "cwd=/opt/erp; /opt/erp/.venv/bin/python; bytecode disabled; no network, database, UAT, container, or deployment access",
      "result": "PASS",
      "exit_code": 0,
      "artifact": "E-002"
    }
  ],
  "risks": [
    {
      "id": "R-001",
      "severity": "LOW",
      "probability": "MEDIUM",
      "impact": "The synthetic protocol gate could be misrepresented as OS- or runtime-enforced isolation.",
      "trigger": "R1.5 evidence is promoted beyond its documented synthetic docs/test scope.",
      "mitigation": "Retain NO_RUNTIME_AUTHORITY and NOT_IMPLEMENTED/NOT_AUTHORIZED declarations for R2, UAT, production, database, and deployment capabilities.",
      "residual_risk": "Runtime enforcement remains unavailable until separately authorized and implemented in R2."
    }
  ],
  "blockers": [],
  "recommendation": {
    "decision": "PASS",
    "reason": "The candidate remains confined to synthetic documentation, tests, and agent-control tooling; no ERP business, product Schema/Migration, or deployment path changed. The frozen contract preserves separation from the D-112 product tables and keeps UAT and R2 capabilities unauthorized. Latest-attempt monotonicity, same-candidate VETO immutability, candidate ordering, terminal Closure, adversarial disposition, and the governance allowlist are fail-closed, and all 56 required native MVP tests passed.",
    "next_action": "Accept the ERP_CONTRACT gate for this candidate."
  },
  "status": "PASS",
  "minority_report": null,
  "resolves_message_ids": [],
  "resolves_claim_ids": [],
  "checkpoint": null
}
